,category,text
1618,GENERAL,saudi arabia name khalid alfalih energy minister replace naimi cabinet reshuffle right industrial executive experience lead reorganization energy electricity sector
1619,GENERAL,danish diver find missing body part swedish journalist kim wall died mysterious circumstance inventor homemade submarine
1620,GENERAL,north korea claim planning fire missile near guam guam isnt worried
1621,GENERAL,erdogan bargained away aleppo opposition abandoned syrian people fate amid violence destruction
1622,GENERAL,nan
1623,GENERAL,paris attack suspect sentenced 20 year prison brussels shootout police abdeslams codefendant sofien ayari also received 20year term attempted terrorist murder
1624,GENERAL,bleached girl india love light skin nonetheless 2014 marketing study found almost 90 percent indian girl cite skin lightening high need
1625,GENERAL,clothes youre wearing may illegally made syrian refugee worker often paid le 1 day stitch clothes major retailer
1626,GENERAL,climate change everyones battle fight climate change longer matter grand strategy matter agenda large seemingly
1627,GENERAL,coral reef changing fast scientist say need rewrite playbook steer coral reef next century need bold
1628,GENERAL,body missing us fitzgerald sailor found flooded compartment seven sailor reported missing us fitzgerald collided container ship
1629,GENERAL,news roundup june 14 2017 today news tomorrow blue 1 six people lost life one worst fire london seen decade report
1630,GENERAL,journey one korea one korea night success initiative shore effort bring north korea change already seen wind change sweep region opening country like myanmar cuba working many partner wind change come shore north korea
1631,GENERAL,russian fighter jet flew within 10 foot u spy plane official say u official deemed incident unsafe unprofessional
1632,GENERAL,syrizas first defeat mean moment matter vast majority greek people first time feel government despite compromise proved made best effort bring europe back table fair equal negotiation term greek bailout program
1633,GENERAL,nan
1634,GENERAL,nan
1635,GENERAL,saudi woman arrested wearing skirt crop top viral video model shared video walking publicly clothing saudi law
1636,GENERAL,thousand migrant refugee finally make germany many stranded day hungary
1637,GENERAL,nan
1638,GENERAL,australian police charge vatican treasurer historical sexual assault cardinal george pell face multiple charge connection historic sexual assault offense
1639,GENERAL,weekend roundup china major power global outlook trump administration cant stop globalization diminish america role governing
1640,GENERAL,fight real enemy terrorism immigration fear terrorist attack causing rise xenophobia erosion civil liberty rise antimuslim activity threat western military intervention middle east
1641,GENERAL,erdoganism kemalism may finally dead turkey turkey headed dangerous direction toward corrupt authoritarian state country need arab spring sort within democratic process electoral revolution street putsch use rule law end illiberal government ballot box must make political power accountable
1642,GENERAL,nan
1643,GENERAL,scottish parliament suspends independence vote debate westminster attack scotland vote whether second referendum day british government due trigger divorce proceeding eu
1644,GENERAL,life really like israel right woke siren today know come hate sound alarm one let know night time work kid day start change every month definitely hit snooze least twice there snooze button siren
1645,GENERAL,russia warns u dont meddle upcoming presidential election vladimir putin government accused u direct interference state department urged country hold genuine election
1646,GENERAL,francois hollande say donald trump make want retch trump presidency would global consequence warned
1647,GENERAL,putin usrussia tie worse since trump took office one could say level trust working level especially military level improved rather deteriorated
1648,GENERAL,afghan civilian among 18 killed u strike isi police say united state confirmed conducted counterterrorism airstrike investigating claim
1649,GENERAL,violence flare near u embassy beirut trump jerusalem decision lebanese security force fired tear gas water cannon protester near u embassy
1650,GENERAL,china say want smooth military tie donald trump presidentelect lambasted china campaign trail suggested japan south korea allowed develop nuclear weapon
1651,GENERAL,nan
1652,GENERAL,major earthquake strike southern coast mexico killing dozen least 60 died powerful earthquake hit mexico eight decade
1653,GENERAL,austria germany open border migrant offloaded hungary hegyeshalom hungarymunich sept 5 reuters austria germany threw open border saturday thousand
1654,GENERAL,nan
1655,GENERAL,firebrand politician look set clinch philippine presidency rodrigo dutertes truculent defiance political tradition drawn comparison u republican presidential candidate donald trump reference libido
1656,GENERAL,nan
1657,GENERAL,russian space agency say investigating embarrassing string failure rocket destroyed last month roscosmos failed update launch coordinate
1658,GENERAL,israeli military charge soldier manslaughter shooting wounded palestinian assailant jaffa israel april 18 reuters israel military filed manslaughter charge monday soldier shot palestinian
1659,GENERAL,israel lost latest chance peace process last friday week political maneuvering israeli prime minister benjamin netanyahu appointed avigdor lieberman
1660,GENERAL,paris honor attack victim somber anniversary ceremony sunday marked one year since attack
1661,GENERAL,israeli army discovers hamasbuilt tunnel stretching gaza israel neutralized tunnel israeli territory rendering unusable infiltration hamas terrorist
1662,GENERAL,germany want european nation take refugee germany country far receive refugee
1663,GENERAL,egyptian billionaire explains plan buy island refugee first get consent government owns island rest simple
1664,GENERAL,protecting egypt coptic christian many way future egypt shaped government majority egyptian treat country
1665,GENERAL,prime minister saad hariris return lebanon moment truth proof pudding prime minister saad hariri return home coming day country friend
1666,GENERAL,jim yong kim start second term world bank president despite rocky first 5 year kims leadership endured consistent criticism
1667,GENERAL,russian foreign minister meet tillerson denies interfering know interfere domestic matter country lavrov said
1668,GENERAL,nan
1669,GENERAL,trump delay imposing new sanction russia official nikki haley said washington preparing new sanction russia support syrian president bashar alassad
1670,GENERAL,china could react trump taunt best worstcase scenario donald j trump phone call past weekend taiwan president tsai ingwen caused much consternation among
1671,GENERAL,nan
1672,GENERAL,saudi arabia quicksand king abdullahs death 2015 halfbrother salman ascended throne saudi arabia discarded tribe
1673,GENERAL,syria russia pound rebelheld aleppo advance halt progovernment force made stride taking control city
1674,GENERAL,british authority reportedly foil terror plot assassinate prime minister theresa may two men arrested late last month connection scheme
1675,GENERAL,bomb threat diverts turkish airline flight canada halifax nova scotia ap bomb threat forced turkish airline flight new york city istanbul divert land
1676,GENERAL,schizophrenia politics delusion deception leader 180 country gathered last week united nation bombing syria begin confusion reign
1677,GENERAL,nan
1678,GENERAL,game life welcome latest generation computer game dont much help escape reality insert back different angle
1679,GENERAL,cologne police screen hundred mostly north african men new year eve police deny screening arrest meant prevent assault amounted racial profiling
1680,GENERAL,accept fact organ donation psa leave sobbing try get video without cry
1681,GENERAL,90 migrant believed missing boat sink libya rate recorded death mediterranean risen sharply year 3740 migrant drowning way europe
1682,GENERAL,asian boat people opposed syrian refugee today speak lot innocent people refugee given opportunity would give back 100 time given
1683,GENERAL,broadening spectrum engaging north korea introduction true lesson recent uptick tension increase pressure pyongyang rather move beyond current approach engagement north korea
1684,GENERAL,photo capture devastating refugee crisis greek island every nightsome 1000 refugeesarriveat greek island lesbos many cramped rubber dingys carrying 35 45 people
1685,GENERAL,rebel offensive brings fierce fighting close heart damascus street empty one resident said
1686,GENERAL,nan
1687,GENERAL,former un chief ban kimoon rule running president south korea made announcement unscheduled news conference parliament wednesday
1688,GENERAL,limiting north korea nuclear ambition responsibility u government recent month advance north korean government nuclear weapon program led sharp confrontation
1689,GENERAL,brazil corruption crisis everyones problem conviction former president lula da silva reminder brazil crisis could even lead brazilian trump global implication
1690,GENERAL,time brand new site israelpalestine peace talk rocket fired retaliation ensues shaky peace follows back another round negotiation stopandstart cycle ceasefire israelgaza confrontation talk turn back restart broken peace process even israel claim fresh territory west bank let u consider something radically different
1691,GENERAL,puerto ricans running money bank closed island mostly still without power
1692,GENERAL,russia blame syrian rebel deadly gas attack denies assad blame united state say administration syrian president bashar alassad responsible attack
1693,GENERAL,britain reopens embassy iran closed since protester stormed compound 2011
1694,GENERAL,mike medavoy movie like manufacturing pair shoe studio making movie legendary producer tell worldpost people get bored
1695,GENERAL,antinuke organization ican win 2017 nobel peace prize group honored groundbreaking effort achieve treatybased prohibition weapon
1696,GENERAL,gunman disguised doctor attack military hospital near u embassy kabul force heavy fighting
1697,GENERAL,trump delay announcement u embassy israel announcement decision made coming day
1698,GENERAL,ousted political party denies role thai blast police hunt suspect analyst say suspicion would inevitably fall enemy ruling junta beaten referendum insurgent muslimmajority province south mostly buddhist country
1699,GENERAL,world war teach u manage north korea crisis delude assumption peace natural state mankind age
1700,GENERAL,russia risk new cold war balkan front line russia cold war lie balkan serbia epicenter russia antiamerican agenda
1701,GENERAL,substance symbolism obamas foreign policy fundamental disconnect substance symbolism president obamas foreign policy case saying one thing another case obama administration case saying one thing delivering style imagery belies authenticity
1702,GENERAL,nan
1703,GENERAL,queen elizabeth ii visit manchester bombing victim childrens hospital interesting everybody united
1704,GENERAL,inside largest refugee camp world ben rawlences book follows nine remarkable refugee kenya dadaab camp home 350000 people
1705,GENERAL,nan
1706,GENERAL,weekend roundup spotlight apprentice vocational apprenticeship program key way adjust constant flux globalization rapid technological change
1707,GENERAL,nan
1708,GENERAL,pope francis missed huge opportunity advocate rohingyas alluded justice respect human right specifically mention persecuted ethnic minority
1709,GENERAL,nan
1710,GENERAL,nan
1711,GENERAL,ecuador earthquake death toll rise 400 billion damage country hit 78 magnitude quake two day ago
1712,GENERAL,architecture helping refugee find job sweden experiment deemed success structure easily taken apart reconfigured elsewhere country region
1713,GENERAL,bangladesh professor hacked death suspected islamist militant five secular blogger publisher killed similar fashion since february last year
1714,GENERAL,makeshift school aleppo offer safer education amid bombing past two year bomb shelling made dangerous student attend official school aleppo
1715,GENERAL,nan
1716,GENERAL,nan
1717,GENERAL,rare double euthanasia 91yearold couple died confidently holding hand dying together deepest wish couple daughter said
1718,GENERAL,danish muslim politician confronts troll claim he really racist sit one meter apart still far apart
1719,GENERAL,western leader demand israeli restraint absolutely interest israel destroy hamas capacity make war murder noncombatant position obama administration supporting israel accomplishing united state continuing al qaida
1720,GENERAL,paris attack kalashnikov balkan ignored enemy within designing longterm strategy implementing effective policy successfully deal radical islam western soil longer delayed immediate future strong rule law nation must deal enemy within midst facilitating
1721,GENERAL,border close family rush refuge urgency filled boat turkey woman child
1722,GENERAL,nan
1723,GENERAL,challenge countering islamist terrorism mainland europe emergence widespread islamist terrorism key european country last year revealed significant
1724,GENERAL,nan
1725,GENERAL,myanmar suu kyi skip un general assembly amid outrage rohingya crisis hundred thousand minority muslim fled myanmar recent week
1726,GENERAL,america love u commando persistent presence russia doorstep
1727,GENERAL,photo reveal brutal reality ignored trump refugee ban president scared syrian refugee theyre scared freezing death home
1728,GENERAL,u preparing case accusing north korea 2016 theft ny fed case would target chinese middleman prosecutor believed helped pyongyang
1729,GENERAL,family begin identify victim spain terror attack fourteen people killed two attack including van rampage barcelona la ramblas walkway thursday
1730,GENERAL,global series talking sex changing culture catesby holmes conversation clea chakraverty conversation fabrice rousselot conversation stephan schmidt
1731,GENERAL,turkey drifting isi putin turkish mainstream political party fully embrace democratic value turkey future becomes uncertain one turkey may find going path russian style expansionism falling prey religious extremism
1732,GENERAL,rohingya muslim beg myanmar authority safe passage terrified well starve soon theyre threatening burn house one villager told reuters
1733,GENERAL,maduro know govern hide doesnt know govern imitate dismal model he inherited mentor plaza revolution result bad copy cuban model crude replica ideology ceded entire terrain raving man
1734,GENERAL,thousand protest harsh new stop abortion bill poland bill latest attempt nationalist government catholic church ban abortion
1735,GENERAL,new gas diesel car 2040 uk vow announcement come week france made similar pledge
1736,GENERAL,breathtaking new year eve firework display better
1737,GENERAL,nan
1738,GENERAL,nan
1739,GENERAL,suicide bomb blast hit nato convoy kabul killing 8 civilian three u service member among 28 people also injured attack
1740,GENERAL,islamophobia charlie hebdo evolved enough reveal life hypocrisy without exhorting gratuitous cruelty insult however much latter may seem part birthright
1741,GENERAL,french president look like he action movie people really excited emmanuel macron got lowered helicopter onto nuclear submarine
1742,GENERAL,nan
1743,GENERAL,australia agrees close refugee detention centre manus island ultimate fate 800 asylum seeker held camp remains unclear
1744,GENERAL,notre dame terror suspect planned attack paris train station france say one woman stabbed police officer arrest shot wounded authority say
1745,GENERAL,nan
1746,GENERAL,turkey referendum free fair turk vote sunday referendum amend constitution establish executive presidency eliminating check
1747,GENERAL,long crazy year since britain shocking brexit vote public opinion impending ukeu divorce hasnt changed much might think
1748,GENERAL,another smog season loom india must act soon keep delhi gasping improving delhi air quality improving delhi air quality research confirms great detail main element
1749,GENERAL,french presidential candidate suggests beleaguered u researcher could work france france homeland offered academic entrepreneur well
1750,GENERAL,saudi arabia right abuse gotten worse since obamas last visit right group say president need speak country dire record
1751,GENERAL,song dance leprosy education 1991 set numerical target accelerate effort eliminate leprosy elimination defined le one
1752,GENERAL,nan
1753,GENERAL,nan
1754,GENERAL,nan
1755,GENERAL,nan
1756,GENERAL,shinzo abe become first japanese leader visit pearl harbor wednesday mark 75 year since attack launched united state entry world war 2
1757,GENERAL,woman gangraped twice men make country horror young woman gang raped twice three year men beyond word could happened
1758,GENERAL,panama paper source break silence offer aid authority immunity explosive document exposed massive corruption network
1759,GENERAL,crack emerge rodrigo dutertes horrific philippine drug war president announced major shift amid growing pressure
1760,GENERAL,eiffel tower go dark solidarity syrian aleppo protester paris denounced bashar assassin
1761,GENERAL,underestimating islamic state obama administration considering campaign air strike hit libya tactical response strategy notion united state ally kill fighter faster organization recruit new one
1762,GENERAL,russia turkey reportedly agree syria ceasefire plan ankara budge opposition syrian president bashar assad staying power
1763,GENERAL,conflict resolution german reunification met jamie walker 1990 specialist mediation conflict resolution worked capacity home west berlin becoming involved peace movement violenceprevention work school system eventually pioneering effort mediating crossborder family conflict
1764,GENERAL,ceasefire doesnt mean party stop using weapon according syria assad despite world power recent agreement cessation hostility syrian army offensive continue
1765,GENERAL,haiti political crisis uncertainty thing know sure political scientist robert fatton jr explains deeprooted challenge haiti next leader face
1766,GENERAL,2000 iraqi day fleeing mosul amid military advance grinding offensive underway take back occupied city isi
1767,GENERAL,brexit sends new shock market political chaos deepens pound continued fall despite attempt ease political economic turmoil
1768,GENERAL,trump israelipalestinian deal present challenge netanyahu two point make bitter pill netanyahu
1769,GENERAL,nan
1770,GENERAL,viber offer free call country affected refugee travel ban affected one le barrier cross trying reach loved one
1771,GENERAL,cairo bomb blast kill six police officer immediate claim responsibility
1772,GENERAL,nan
1773,GENERAL,south korea troll north loudspeaker blaring news defector north korean within 12 mile border reportedly hearing update wounded soldier condition
1774,GENERAL,nan
1775,GENERAL,south korea vow tougher law sexual abuse amid metoo movement metoo movement event boiling rage finally erupted genderbiased power relation gender inequality long deeprooted evil society
1776,GENERAL,duterte ordered killing hitman tell philippine senate hearing ordered u kill muslim edgar matobato said
1777,GENERAL,defiant north korea launch appears icbm pyongyang first missile launch since firing japan september
1778,GENERAL,afghan debate terrorism level opinion leader whose view trickle social medium afghan debate terrorism reveal strong ethnic prejudice vocal nonpashtun opinion leader view terrorism ethnic lens
1779,GENERAL,uber deliveroo food courier want better pay working condition poverty innovation australian union official say
1780,GENERAL,protect refugee must confront anxiety muslim europe european policymakers must address cultural political anxiety islam refugee head rather ceding
1781,GENERAL,world leader gather burial former israeli leader shimon peres palestinian president mahmoud abbas israeli prime minister benjamin netanyahu even shook hand funeral
1782,GENERAL,russian jet pound aleppo u cling diplomacy latest strike come 10 day russianbacked syrian government offensive capture rebelheld eastern aleppo
1783,GENERAL,north korea focus trump call japan china also discussed trade issue
1784,GENERAL,putin say trump satisfied election meddling denial trump asked pointed question answered seemed satisfied answer russian president said
1785,GENERAL,nan
1786,GENERAL,turk celebrate failedcoup deadly clash end democratic victory power higher power people president recep tayyip erdogan told citizen
1787,GENERAL,child forced front line yemen war mean future country
1788,GENERAL,nan
1789,GENERAL,putting syrian work jordan easier said done despite much fanfare international jordanian policy change yet produce desired number formal job
1790,GENERAL,dubai florence 21st century perhaps significant similarity florence yesterday presentday dubai surroundings like florence home renaissance darkness dominated europe dubai beacon hope enlightenment look happening neighboring arab muslim country
1791,GENERAL,u giving 32 million assist rohingya refugee trump administration first show support persecuted minority
1792,GENERAL,13 dead unexplained illness liberia health authority believe accidental poisoning event cautiously monitoring situation
1793,GENERAL,poll briton narrowly support remaining eu result contrast poll friday showed leave campaigner 10 point ahead
1794,GENERAL,philippine forgotten revolution general luna quest independence brutal assassination luna fellow revolutionary saw arrogance merit serf cautionary tale reminder philippine greatest enemy internal division narrow loyalty stunted nationbuilding quest date
1795,GENERAL,reaching last mile south sudan community health worker first time life freedom santo traditional healer south sudan recently felt positive recognition
1796,GENERAL,proisrael mean label insinuates primary concern reaching best outcome state israel irony sometimes socalled proisrael people advocating policy hurt israel
1797,GENERAL,mean russian ambassador turkey assassinated radicalized militant jihadi offduty turkish police officer ahmet yayla phd anne speckhard phd russian ambassador turkey andrey karlov shot killed
1798,GENERAL,vladimir putin strip icecold dip religious ceremony russian president taking part epiphany celebration
1799,GENERAL,boko haram kill least 18 nigerian border boko haram sent u mourning
1800,GENERAL,3000 migrant saved mediterranean sea 30 separate rescue mission migrant packed board dozen boat many rubber dinghy become dangerously unstable high sea
1801,GENERAL,kenya sign china south africa coal deal kenya one promising future africa make strategic mistake similar one
1802,GENERAL,asylum application mexico surged trump election november 2016 march mexico refugee agency comar received 5421 asylum application 2148 period 2015 2016
1803,GENERAL,britain eu reach deal clearing way referendum membership david cameron must wage intense campaign convince citizen vote stay eu
1804,GENERAL,london mayor say uk roll red carpet donald trump sadiq khan reiterated opposition week president impending state visit country
1805,GENERAL,u weapon used deadly bombing yemen say human right group washington say support saudi arabia help minimize civilian harm attack last month allegedly using ussupplied weapon killed 100 people
1806,GENERAL,nan
1807,GENERAL,nan
1808,GENERAL,yemen summit hailed remarkable success million still need lifesaving aid yemen serious risk plunging famine race time
1809,GENERAL,internet help afghan woman find voice battle equality regular electricity outage insecurity dented afghanistan addiction internet social medium
1810,GENERAL,rodrigo duterte sworn philippine president inaugural speech vowed wage relentless sustained battle crime
1811,GENERAL,gambia president yahya jammeh stay office 3 month despite losing election much peaceful transition power
1812,GENERAL,syria survive conflict russia united state seeming proxy war two country would leave syria shamble
1813,GENERAL,isi loses syrian town key belief apocalypse fleeing dabiq militant group scrambling explain world isnt ending
1814,GENERAL,nan
1815,GENERAL,former french president nicolas sarkozy reportedly police custody official say he questioned part investigation suspected irregularity election campaign financing
1816,GENERAL,nan
1817,GENERAL,canada first female prime minister call trump sexual predator threat democracy
1818,GENERAL,notre dame memorial service honor victim paris attack historic cathedral carried special tribute paris victim
1819,GENERAL,australia responsible immigrant child suffering detention un investigator say acceptable
1820,GENERAL,u owes afghanistan u involvement war afghanistan may coming end u commitment improving human right afghanistan
1821,GENERAL,israel launch heavy air strike syria fighter jet crash syrian army say shot f16 jet crashed northern israel
1822,GENERAL,german minister say trump ignored fact dig angela merkels refugee policy im sorry republican presidential candidate trumpet thing like without factual basis
1823,GENERAL,u turkey mutually suspend visa service arrest consulate employee person allegedly linked fetullah gulen cleric blamed last year coup
1824,GENERAL,towards difficult phase marked assads survival read development field international accord realignments iraq syria beginning
1825,GENERAL,al qaeda move india presage elsewhere al qaeda aqs declaration starting franchise south asia surprise given sheer number muslim region eclipsed islamic state headline
1826,GENERAL,gunman kidnap australian firm worker nigeria attacker killed driver abducted least seven people ambush
1827,GENERAL,wallaby hopped across sydney harbour bridge traffic australian thing ever
1828,GENERAL,nan
