,category,text
3128,SCIENCE,eta aquarid meteor shower peak today may 5 find dark spot city light street light ruin stargazing attempt outshine object like meteor
3129,SCIENCE,living mar photo show red planet might look water wasnt intended exhaustive scientific scenario im sure expect assumption prove incorrect
3130,SCIENCE,consensual sadomasochism may actually lead altered state consciousness spiritual sexual see interesting disconnect sagarin said think may indicative type
3131,SCIENCE,rosetta spacecraft crash land comet bringing historical mission end end rockandroll fashion
3132,SCIENCE,awe increase religious belief analysis astronaut report reveals many awesomeness spaceflight increased belief god new research may explain
3133,SCIENCE,exploring invisible much modern physic exploring inherently invisible thing seem far common obvious thing experience sens yet invisible thing follow rigorous law allow u test existence many way short list invisible thing routinely work
3134,SCIENCE,scientist discover feathered dinosaur tail trapped amber surprise finding 99 million year old
3135,SCIENCE,transistor single atom size created australian scientist thought electronic device couldnt get smaller come word australian scientist fabricated
3136,SCIENCE,retired lab chimp already loving new home hug kiss grooming
3137,SCIENCE,nan
3138,SCIENCE,easter island diet consisted rat seafood new study show fish eater may lived part island fishing easier commendador suggested another possibility
3139,SCIENCE,researcher find second u patient infected superbug gene mcr1 gene make bacteria highly resistant lastresort antibiotic called colistin used treat multidrugresistant infection
3140,SCIENCE,new march science particularly beautiful day today new connecticutbut everyone gathered 2000 strong
3141,SCIENCE,right way care contact according chemistry cant believe say dont store beer
3142,SCIENCE,helix nebula photo giant eye space spotted nasa telescope pair nasa space telescope captured spectacular new photo helix nebula glowing celestial vision
3143,SCIENCE,nan
3144,SCIENCE,april fool day science includes five bogus discovery scientist science journal advantage come fooling rest world april 1 one thing
3145,SCIENCE,thomas edison greatest invention innovation edison also made useful contact news reporter worked closely telegraph operator israel explained many
3146,SCIENCE,8 year extreme adventure photo far national geographic wowza
3147,SCIENCE,geoengineering white sky seeding stratosphere sulfate said possible 887 participant survey 69 percent said strongly somewhat believed harm
3148,SCIENCE,higgs mass universe recent hoopla longsought higgs boson often hear said responsible mass universe true assuming exists higgs boson actually responsible small fraction total mass universe
3149,SCIENCE,grail moon video show nasa craft lunar orbit quite surreal beautiful timelapse footage taken ebb skimmed across part northern terrain
3150,SCIENCE,matt powner make protocell protocell pioneer matthew powner freshfaced good look athlete youd expect show world cup 2014 voice somewhat reminiscent british invasion relaxed focus project signal something profoundly urgent matt powner chemistry origin life mind
3151,SCIENCE,end world science artist ron miller envisions apocalypse scenario photo ron miller created many engaging science image series including planet would look like saturn
3152,SCIENCE,huffpost science top five story week jan 2025 video fourstranded dna radioactive fish disco clam chance count top five science story
3153,SCIENCE,troublesome leak ground nasa next mission mar duct tape wont fix apparently
3154,SCIENCE,writing eye could allow paralyzed people communicate neuroscientist say four decade later cognitive neuroscientist jean lorenceau universit pierre et marie curie paris idly watching
3155,SCIENCE,nan
3156,SCIENCE,queen skeleton goldbedecked bone found near london suggest regal status woman adorned necklace tubeshaped bead fashioned sheet gold black disk lignite
3157,SCIENCE,shiri robotic butt offer new insight uncanny valley video top 7 useful robot buy right today human ready love tomorrow robot 5 reason fear robot copyright
3158,SCIENCE,nasa space weather radiation bubble linked human activity cold war highaltitude nuclear explosion resulted extra radiation close earth
3159,SCIENCE,science misleading fundamental truth isnt lecture quantum mechanic isnt argument existence god truth
3160,SCIENCE,fourwinged bird extra feathered limb may helped early bird flight study suggests photo new study published journal science friday provided first solid evidence least
3161,SCIENCE,spacex land reusable falcon 9 rocket update despite initial worry company done
3162,SCIENCE,japanese space agency mission aim uncover moon mar formed mmx exciting mission
3163,SCIENCE,saturn ring riddle finally solved much planet ring
3164,SCIENCE,3 scientist win nobel prize physic work detecting gravitational wave rainer wei barry c barish kip thorne share prize
3165,SCIENCE,nan
3166,SCIENCE,nan
3167,SCIENCE,chinese space station adrift year plummet earth tiangong1 mostly burnt reentered earth atmosphere piece likely crashed pacific ocean
3168,SCIENCE,immunize bad mood new research suggests may possible bad mood known slow cognition study coauthor dr shay benhaim researcher university said written
3169,SCIENCE,china launch 200day test selfsustaining space station student say happy act human guineapigs mean getting closer dream becoming astronaut
3170,SCIENCE,cure depression era tight budget supporter depression research argue funding needed find cure thats logicalsounding may totally wrong depression toll risen even research treatment resource poured combating
3171,SCIENCE,11 science fact seem like science fiction day hard tell reality makebelieve
3172,SCIENCE,fur fly first scientific conference animal consciousness bird dolphin elephant mouse prehistoric human being creature modernday people posse call consciousness brain researcher around world set explore question summer
3173,SCIENCE,great barrier reef like youve never seen david attenborough us new technology create interactive journey highlighting peril climate change
3174,SCIENCE,long lonely liminal whatever case may know awestruck first saw photographsim talking course photograph
3175,SCIENCE,facebook tied feeling fat eating disorder leslie meredith published 03302012 0516 pm edt technewsdaily look fat answer resounding yes
3176,SCIENCE,giant gas cloud coming toward u 700000 mile per hour 30 million year plow milky way
3177,SCIENCE,youre chimpanzee dont make love like one since christmas approaching im tempted say book might make good stocking stuffer male ego fragile delicacy required part giver must somehow insinuate shes trying improve already awesome performance
3178,SCIENCE,anticipation psychology waiting line spend lot time waiting line way wed like waiting something new exciting doesnt waiting new purchase become positive experience actually savor anticipation much trump impatience well yes
3179,SCIENCE,nasa straight panda mouth despite agency done despite offer long human spaceflight core nasa existence never evolve beyond faint echo prior self
3180,SCIENCE,mummy myth debunked new study ancient egyptian embalming practice fifth century bc herodotus father history got inside peek egyptian mummification process embalming
3181,SCIENCE,end world know might time say goodbye holocene epoch
3182,SCIENCE,partial lunar eclipse june 4 moon earth umbral shadow partial lunar eclipse visible primarily across western central part united state canada
3183,SCIENCE,curiosity rover team shift back earth time using martian sol spacecom staff published 11092012 0817 est spacecom phase completing working together
3184,SCIENCE,meteor shower demand could coming soon sky near part excitement seeing meteor dumb luck involved right place right time outside
3185,SCIENCE,hundred new specie found himalaya last 5 year talk biodiversity couldnt make creature
3186,SCIENCE,woman paleontology celebration female field scientist there little girl blue eye wide step microphone shes fiveyearold front room
3187,SCIENCE,bill nye yearbook photo popular science guy thing bow tie high school yearbook photo believed appears popular science guy bill nye william called
3188,SCIENCE,deciphering monsoon time drastic change increasing irregularity monsoon affect life around world know climate change affect monsoon behavior best scientific hypothesis may never return steady dependable monsoon climate change may fatally break ancient relationship farmer monsoon
3189,SCIENCE,im scientist learning disability thats okay intelligence like pretty much everything else subjective spectrum may lower average one every single area doesnt anything good job whether thats scientist clinician business woman
3190,SCIENCE,cant stand heat get universe continue planetaryscale geoengineering experiment pumping carbon dioxide atmosphere seeing happens worth considering maybe path already taken predecessor long time ago galaxy far far away
3191,SCIENCE,mar snowflake diameter human red blood cell mit study show spacecom staff published 06222012 1223 pm edt spacecom occasionally laser beam returned faster anticipated
3192,SCIENCE,interested mar olympics mar race human survival understanding place vast terrifyingly beautiful universe story athlete mathletes worldclass accomplish nearimpossible task cosmic scale hardest sport could ever compete
3193,SCIENCE,motherboard tv william shatner video interview dont know came given famous sense humor gentlemanly persona referenced famously
3194,SCIENCE,science behind hypnosis hypnosis real phenomenon even animal hypnotized hypnotism exactly remains unclear remarkable experiment reported new york time 1 subject given posthypnotic suggestion would see word would appear incomprehensible foreign language
3195,SCIENCE,mar rover celebrate birthday singing alone desolate planet curiosity rover given nasa plenty celebrate
3196,SCIENCE,zika virus least 50 year old here youre hearing infectious disease specialist explains need know
3197,SCIENCE,squid octopus color change ability tied switchable cell water flux show diffusion neurotransmitter applied squid skin upper right induces wave iridescence
3198,SCIENCE,nasa astronaut peggy whitson spent recordbreaking 665 day space 57yearold trailblazer returned third mission international space station saturday
3199,SCIENCE,nan
3200,SCIENCE,counting math super bowl prediction team going win super bowl year fan short fanatic right may strong subjective feeling outcome possible come objective prediction based mathematics
3201,SCIENCE,american little faith scientist science journalist poll much faith american scientist science journalist whole lot new survey find huffington
3202,SCIENCE,nan
3203,SCIENCE,animal propulsion study reveals jellyfish specie bend rule motion video pressure gradient pull jellyfish water little exertion research jellyfish propulsion
3204,SCIENCE,here plant feeling people head neuroscientist show quite inception fascinating nonetheless
3205,SCIENCE,kid adorable observation world may crucial survival scientist reveal kid keep getting caring attention parent grow cute baby face
3206,SCIENCE,moby dick may whale tale new research suggests sperm whale use huge head battering ram ship
3207,SCIENCE,asteroid killed dinosaur new study suggests comet instead caused extinction event rocky object wiped dinosaur 65 million year ago may comet rather asteroid scientist
3208,SCIENCE,ancient cave drawing found brazil depict armadillo animal photo whitelipped peccary may glamorouslooking like trufflesniffing cousin sometimes turn treasure
3209,SCIENCE,becoming expert make closedminded beware major downside acquiring expertise
3210,SCIENCE,nan
3211,SCIENCE,nan
3212,SCIENCE,space cat viral video creator explains april fool joke video image widgen show cat originally saying still see feline signature also
3213,SCIENCE,florida python challenge net 106 snake monthlong hunt daniel moniz said took snakebite face wrestling 13footer snagged two top prize
3214,SCIENCE,fountain fire used erupt moon know like soda bursting shakenup
3215,SCIENCE,nan
3216,SCIENCE,loch ness monster mystery solved nessie bubble seismic activity geologist say video throughout year highprofile sighting nessie suspected outed hoax according pb
3217,SCIENCE,democratic candidate stand little idea called science watch bernie call donald climate change theory
3218,SCIENCE,stephen hawking finished mindbending parallel universe paper day death new treatise existence parallel universe published friday
3219,SCIENCE,cern discovery scientist find new subatomic particle could elusive higgs boson higgs particle although crucial understanding universe formed remains theoretical explains
3220,SCIENCE,craig venter mar dna plan rebuild martian earth lab move dna meet durable xna technewsdaily staff published 10192012 0154 pm edt technewsdaily
3221,SCIENCE,europe oldest living inhabitant looking pretty darn good inhabitant happens tree
3222,SCIENCE,nan
3223,SCIENCE,predicting psychosis risk pretty risky originally called psychosis risk repackaged modestly attenuated psychotic symptom however named renamed dangerous idea little benefit extremely risky unintended consequence
3224,SCIENCE,breathtaking photo show snowmageddon blizzard space dramatic photo show east coast wintry transformation hit hurricaneforce wind several foot snow
3225,SCIENCE,new horizon mission give pluto second chance planethood pluto planet simple question one scientist space buff debating year back 2006
3226,SCIENCE,ets could reach u interstellar laser columbia university astronomer suggest new way might grab attention alien civilization
3227,SCIENCE,mindreading skill boosted reading literature study suggests perhaps surprise lead author new study david kidd came social psychology way russian literature
3228,SCIENCE,nan
3229,SCIENCE,pluto blue sky red ice nasa say distant dwarf planet keep surprising u
3230,SCIENCE,world need scientific rationalism science today power inspire much always today important ever scientific community capitalize every opportunity get reengage take war science indeed come
3231,SCIENCE,early human explorer neanderthal homo erectus may mediterranean mariner exceedingly old age artifact suggests seafarer made might even modern human originated
3232,SCIENCE,spreading pseudoscience 5 reason liberal bad conservative first step solving problem identify understand mind list five reason liberal bad least almost creationismbelieving conservative come spreading pseudoscience
3233,SCIENCE,nan
3234,SCIENCE,need know paris climate summit doordie time climate change effort world leader converge french capital
3235,SCIENCE,luis p villarreal need nonlinear language life published book origin synthesis life fascinated learn id missed interviewing one field provocative scientist virologist luis perez villarreal take virusfirst perspective life
3236,SCIENCE,mysterious fungus people talking unusual appearance lot
3237,SCIENCE,last man moon eugene cernan call space station nasa mission control visit video spacetoground conversation aired nasa television channel streamed space agency website
3238,SCIENCE,hold phone might miss whale even whale bright idea like laser dr townes instead taking timeout sent text played angry bird might dark laser research townes example suggest unpredictable spark mental machination something dont want miss majestic sight passing whale
3239,SCIENCE,tiny robot stingray made gold rat heart also swim latest cyborg department
3240,SCIENCE,nan
3241,SCIENCE,solar system may fifth giant planet missing planet bumped neptune disappearing abyss space according new study
3242,SCIENCE,scientist use dna velcro print human tissue lab new technique could one day solve intractable problem organ shortage
3243,SCIENCE,nan
3244,SCIENCE,greatest psychologist realm human endeavor one person ever stand clearly greater great field many great one person ever shine brightest psychology exception charles darwin tower field
3245,SCIENCE,maya civilization collapsed amidst mild drought new study suggests keith prufer maya archaeologist university new mexico albuquerque worked closely paleoclimatologists
3246,SCIENCE,science world museum orgasm kill pain ad spice science sexuality exhibit photo hat tip ad world like put word way youll remember museum spokesman jason bosher told
3247,SCIENCE,earth core blob chemical interaction may shed light composition planet finding might help explain dense layer thought exist deep mantle planet mercuryhowever
3248,SCIENCE,wtf evolution favorite tumblr book truth told dont spend whole lot time tumblr masterpiece worth keeping eye one favorite mara grunbaums wtf evolution take regular look evolution strangest perplexing creation plenty time xmas gunbaums evolutionary freak show book
3249,SCIENCE,nan
3250,SCIENCE,exotic particle extra dimension may await discovery physicist say another idea suggests particle already found actually fundamental meaning sub
3251,SCIENCE,nan
3252,SCIENCE,drug ebola virus first outbreak ebola 1976 nearly 40 year ago yet cure
3253,SCIENCE,blink much blinking provides mental rest new research suggests researcher found point natural break occurred video two thing happened stop elicited
3254,SCIENCE,fat people get radiation xrays study show study published april 6 journal physic medicine biology high dos radiation known
3255,SCIENCE,take rare look world biggest heart size maybe small golf cart
3256,SCIENCE,nan
3257,SCIENCE,rod cone alone approximately 120 million rod 6 million cone retina help u see know another type light sensitive cell intrinsically photoreceptive retinal ganglion cell type cell retina nothing vision
3258,SCIENCE,nan
3259,SCIENCE,bill nyes take whether gay make evolutionary sense science guy doesnt always answer good advice
3260,SCIENCE,make firefly light here whole story research implication beyond bug butt
3261,SCIENCE,richard branson return passenger space travel race new craft unity named british physicist stephen hawking
3262,SCIENCE,eclipse october sky moon totally earth shadow called totality moon turn eerie shade red sunlight bend earth atmosphere reach totality earth shadow slowly wipe moon return normal full self
3263,SCIENCE,nan
3264,SCIENCE,russian proton rocket suffers launch failure industry official remarked august 2012 failure two russian satellite one commercial fleet operator
3265,SCIENCE,great meteor procession 1913 mapped astronomer 100 year later scientist still missing piece astronomical puzzle one knew exactly widereaching
3266,SCIENCE,terrifying clip show never run tree thunderstorm yikes
3267,SCIENCE,new year kick supermoon lunapalooza 2018s biggest supermoon followed end january super blue blood moon
3268,SCIENCE,watch octopus meet blind date tricky sex february 14 hazel franklin meet blind date good chance thing get heavy likely first possibly last chance either sex adult life also small chance franklin get eaten
3269,SCIENCE,scientist pinpoint source stonehenge smaller stone new study video wiltshire england site harbor evidence ancient occupation trace pine post raised 10500 year
3270,SCIENCE,get thrill safari without ever leaving home twice day viewer travel live bush comfort living room
3271,SCIENCE,inmate seem taken asylum entered truly remarkable silly season interacting absurdity committed american psychiatric association national institute mental health british psychological society may turn cruelest month mental health
3272,SCIENCE,nan
3273,SCIENCE,nan
3274,SCIENCE,saturn ring cassini probe orbit planet offering new view photo tariq malik published 07132012 0424 pm edt spacecom follow spacecom twitter spacedotcom also facebook
3275,SCIENCE,beertapping physic scientific explanation behind fun bar trick video plume bubble fragment form voila rapidly rising foam result see video detail ever tried
3276,SCIENCE,sexism science actually paternalism improvement medical ethic past thirty year tend think paternalistic attitude longer minimally exists however paternalism science alive healthy
3277,SCIENCE,stone age snail may migrated trader southern france ireland 8000 year ago subpopulation specie found western ireland range twice size distinctive white lip
3278,SCIENCE,mummy brain gray matterremoval tool found ancient egyptian skull identifying ancient tool embalmer used brain removal difficult researcher note second
3279,SCIENCE,drought cost californian extra 2 billion electricity expense new report pacific institute tallied four year drought impacted electricity price pollution
3280,SCIENCE,12yearold film pod killer whale attacking dolphin behold awesome power mother nature hierarchy
3281,SCIENCE,cognitive ability change throughout life popular notion baby brain little sponge older adult mind washed really hold water difficult see scientifically cognitive system change grand time scale entire life
3282,SCIENCE,nan
3283,SCIENCE,majorana fermion particle evidence found physicist majorana confirmed expected property make ideal constructing quantum computer
3284,SCIENCE,whale song beatles computer analysis musical style vocal communication whale sound like song whale sing algorithm able analyze song made whale started wonder well could analyze song made human made sense give try
3285,SCIENCE,thomas edison voted iconic inventor u history doesnt mean job lack fan wake death last year man relentlessly drove apple create
3286,SCIENCE,planetary nebula ngc 2392 radiant death star photo composite image ngc 2392 contains xray data nasa chandra xray observatory purple showing location
3287,SCIENCE,nan
3288,SCIENCE,nasa aircraft spot mysterious circle remote arctic sea ice scientist say havent seen feature
3289,SCIENCE,discovered 3 planet could sustain life discus mean talk nerdy
3290,SCIENCE,educator starting embrace concept good screen time video game may bad actually could help kid learn science
3291,SCIENCE,mar rover crash curiosity doesnt touch safely president barack obamas 2013 federal budget request released february slash nasa planetary science program
3292,SCIENCE,airport scanner reveals hidden art behind priceless louvre mural scientist say fact scanner like used airport security fullbody scan looked beneath surface
3293,SCIENCE,two higgs boson cern scientist revisit large hadron collider particle data original higgs data back july shown higgs seemed decaying two photon often
3294,SCIENCE,nasa spacecraft juno begin orbit jupiter five year hundred million mile later juno orbit
3295,SCIENCE,cassini prep death plunge saturn sends farewell image tiny earth barely visible dot home could perceived exoplanet faraway perspective
3296,SCIENCE,mar affordable achievable human venture mar sense fulfill longing collective psyche humanity dreamed
3297,SCIENCE,earhart plane debris may found ocean floor han van tilburg coordinator maritime heritage program pacific region national oceanic atmospheric
3298,SCIENCE,nan
3299,SCIENCE,15 photo astronaut year space world scott kelly twitter feed gave u incredible view earth
3300,SCIENCE,nan
3301,SCIENCE,wormhole record centuriesold european woodblock print show distribution woodboring beetle wormhole technique might also help solve question art history well situation
3302,SCIENCE,nan
3303,SCIENCE,nan
3304,SCIENCE,nan
3305,SCIENCE,nan
3306,SCIENCE,nan
3307,SCIENCE,brain obesity neural implant could curb overeating mouse study suggests deep brain stimulation already used way help reduce tremor patient parkinson disease scientist
3308,SCIENCE,cute bat reveal something common dog cat might seen puppy
3309,SCIENCE,nearby minimoons eyed possible target future manned space mission dod us radar optical tool detect spy satellite country bottke said question arises
3310,SCIENCE,eccentric planet yet known fascinating object
3311,SCIENCE,wild turkey hate wild bird reintroduced new england long absence chose live city instead forest called home
3312,SCIENCE,el nio brings extremely venomous sea snake california snake made home abnormally warm water california coast
3313,SCIENCE,missing comet lander philae finally located long search hunt
3314,SCIENCE,first look adorable baby rhino born toronto zoo cuteness alert
3315,SCIENCE,9 discovered specie made 2015 dinomite year one specie described feathery fluffy winged chicken hell
3316,SCIENCE,poll show half american think u losing leadership space majority republican independent preferred private company run space program democrat equally
3317,SCIENCE,say hello one neighbor sculptor dwarf galaxy elusive galaxy sits 280000 lightyears earth
3318,SCIENCE,deflated football mother nature didnt unless rip van winkle well aware football game new england underinflated talk weather blame run number here equation look like
3319,SCIENCE,last chance ask candidate science question nothing impact modern life science yet candidate rarely asked question almost never mention speech neglect almost insane proportion even child know
3320,SCIENCE,polar bear trap team scientist inside remote weather station russia bear live arctic know cant ban hanging around
3321,SCIENCE,venus transit national park prepare rare celestial event transit venus 2012 complete coverage gallery transit venus across sun history venus transit sun
3322,SCIENCE,dinosaur skinny curved bone suggest prehistoric beast weighed le previously thought finding another intriguing question bone curved first place rare exception fossilized
3323,SCIENCE,u climate scientist flee france make planet great america top researcher move france continue research
3324,SCIENCE,one doctor waging war bullst science time
3325,SCIENCE,ripoff knife body double brain recognizes fake impostor brain recognition system neither simple always predictable ever felt sure youd seen friend face crowd realize youd creeped stranger staring long
3326,SCIENCE,obama welcome heroic astronaut back earth dad joke punny mr president
