,category,text
0,POLITICS,cashless toll road proliferate rental car fee rental car driver likely navigate electronic toll state convert traditional cash toll electronic
1,POLITICS,trump war truth trying destroy credibility everybody hold accountable
2,POLITICS,trump campaign float every defense book second amendment fiasco didnt mean
3,POLITICS,doug ducey v fred duval v barry hess nonpartisan candidate guide arizona governor race 2014 looking nonpartisan voter guide doug ducey v fred duval v barry hess governor race one give unbiased nospin comparison candidate position key issue thats campus election engagement project guide give
4,POLITICS,seattle teacher halt protest honor 911 anniversary teacher received costofliving pay raise six year
5,POLITICS,white voter people think thats good news trump one biggest reason donald trump considered long shot win presidency diversity country
6,POLITICS,nan
7,POLITICS,supreme court preview judicial roadmap court veers right get ready rocky ride
8,POLITICS,bobby jindal launch attack chris christie mike huckabee spending louisiana governor homework
9,POLITICS,debunking many myth american believe iran election donald j trump ever important separate truth fiction fact opinion
10,POLITICS,republican tax bill make le desirable company hire veteran people developmental disability worked new york city placing people developmental disability job eight year one
11,POLITICS,huffpollster hillary clinton donald trump take big delegate haul trump seems track win nomination
12,POLITICS,arming enemy crossposted tomdispatchcom 19 alqaeda militant armed boxcutters knife hijacked four american
13,POLITICS,join huffpost talk cnn republican debate gonna great
14,POLITICS,donald trump perfected art making immigration policy dumb practical solution immigration tough sell place like arizona
15,POLITICS,eric garner value black obese body imagery giant brutish kingkonglike black man threatening city far new currently seems intersecting dangerously another popular rhetorical image obese person responsible frail unworthy body intersection especially display eric garner case
16,POLITICS,supreme court reject exxon appeal groundwater contamination case 236 million judgment largestever jury verdict new hampshire
17,POLITICS,presidential debate started superawkward minute silence weird
18,POLITICS,fresh memory massacre haunt south carolina background check debate hillary clinton elevated charleston loophole national prominence effort close face uphill battle
19,POLITICS,democrat defeat republican virginia court clerk race party held legislative seat alabama well
20,POLITICS,tuesday morning email shutdown fear grow amid daca fight trump daca comment
21,POLITICS,legalization march continues without democrat lead nancy pelosi got reelected lead house democrat almost third voted much younger representative
22,POLITICS,donald trump deleted embarrassing tweet alabama loss president wiped message support incumbent luther strange
23,POLITICS,dont democrat temptation democrat jump russiagate strong dangerous
24,POLITICS,obamacare repeal possibly going live farm upstate real pretty say
25,POLITICS,nan
26,POLITICS,susan rice didnt anything untoward intelligence obamas national security adviser reiterated point
27,POLITICS,bernie sander medicare online town hall draw 1 million live viewer vermont senator delighted circumventing television network
28,POLITICS,american arent thrilled trump threat fire fury north korea public split trump overall handling north korea think he improving situation
29,POLITICS,disaster like harvey irma show lawyer stodgy rule kick american theyre aware legal crisis harvey left wake lawyer texas joined rank first responder
30,POLITICS,trump administration pushing jerusalem embassy move next year report state department move retrofit existing building rather construct entirely new one
31,POLITICS,donald trump campaign manager open door leaving campaign unless
32,POLITICS,donald trump rally look like scene nazi germany getting way scary
33,POLITICS,chief justice robert cast courtesy vote spared alabama inmate execution rare move come supreme court continues operate without ninth member
34,POLITICS,charged rape pleaded contest assault charge he suing victim feel like nightmare doesnt end
35,POLITICS,bernie sander scorched earth strategy seems working bernie sander realistic path democratic nomination despite protestation postmodern mathematician
36,POLITICS,kasich wouldnt cancel iran deal would send troop fight isi unlike republican rival ohio governor suggested wouldnt immediately rip obamas agreement iran elected president
37,POLITICS,nan
38,POLITICS,trump pick death china author trade advisory role navarro made documentary describing beijing threat u economy
39,POLITICS,huffpollster republican doubt donald trump chance november proportion think trump win declining
40,POLITICS,donald trump cant even pronounce beyoncs name right honestly expect point
41,POLITICS,republican texas judge officiates gay wedding come democrat youve heard common expression thousand time didnt leave party party left true
42,POLITICS,chuck grassley introduces donald trump rally endorse grassley said wont making endorsement ahead iowa caucus
43,POLITICS,nan
44,POLITICS,joe biden reflects he learned note self biden touched several hardship he endured
45,POLITICS,rex tillerson swamp creature say top trump campaign adviser myron ebell want trump pull u paris climate pact think secretary state standing way
46,POLITICS,nan
47,POLITICS,donald trump jr admitted committed crime planning crime failing successfully pull still crime
48,POLITICS,donald trump making air travel even miserable new extreme vetting rule headache many traveler could costly u tourism
49,POLITICS,maryland gov larry hogan say cancer 95 percent gone said aced screening
50,POLITICS,oklahoma court halt 3 pending execution drug glitch oklahoma city ap oklahoma highest criminal court agreed halt three upcoming execution state prison
51,POLITICS,here problem hillary clinton electability argument democratic voter dont see chance winning
52,POLITICS,nan
53,POLITICS,nan
54,POLITICS,senate democrat plot sequestration downfall coming month may last best chance eliminate spending cap obama era
55,POLITICS,nan
56,POLITICS,biden wouldve beat hell trump high school abuse woman former vice president spoke university miami antisexual violence rally tuesday
57,POLITICS,new jersey senate override christie veto gun control bill new york oct 22 reuters new jersey senate voted override governor chris christie veto gun control bill
58,POLITICS,history united state look cool gifs history iconic moment immortalized gifs courtesy national archive
59,POLITICS,paul ryan suggests steve scalise support kevin mccarthy speaker already getting weird
60,POLITICS,black voter turnout far good hillary clinton several key state
61,POLITICS,stop freaking new trump poll doesnt actually tell u much win state primary
62,POLITICS,balance public federal budget deficit economist left argue deficit serious threat health economy expert say projected increase show longterm solution need found public think debate
63,POLITICS,new york court redefines mean parent ruling major implication samesex couple
64,POLITICS,republican presidential field sadly lacking right country deserves better array perhaps poll narrow money dry hear better really disappointing field people aspire lead u look frail
65,POLITICS,3 banking regulation cant let republican take away republican already signaled one first priority repeal cripple regulation supposed keep economy stable protect american money job prevent wall street consumer fraud abuse
66,POLITICS,nan
67,POLITICS,nan
68,POLITICS,twitter user blast donald trump using hurricane harvey political cover guy awful freaking human
69,POLITICS,trump golf course management tell u hed president promising
70,POLITICS,chicago teacher avert strike would impact hundred thousand student teacher whove worked without contract since june 2015 still vote tentative deal
71,POLITICS,monday morning email devil charles manson mesmerized america cult leader 83
72,POLITICS,nan
73,POLITICS,technology disrupted leak tradition instant leak using encrypted messaging apps expanding deep state beyond shadowy cia operative
74,POLITICS,hillary clinton calling trump supporter deplorables handed political gift clinton gave first major tv interview since 2016 presidential race ahead release new book reflecting election defeat
75,POLITICS,nan
76,POLITICS,obamas labor team took aim wage theft theyre gone january well see trump team ready target industry like fast food worker often get stiffed
77,POLITICS,gun control debating gun control way uniquely american problem also touch many fundamental question government
78,POLITICS,huffpollster donald trump really leading ohio depends poll look
79,POLITICS,nan
80,POLITICS,nan
81,POLITICS,attention senator mccain little reading crossposted fromtomdispatchcom memo senator john mccain senator day noticed chairman
82,POLITICS,lawyer cop killed zachary hammond try change story new detail still dont explain officer chose shoot
83,POLITICS,social security increasingly crucial kid report find 64 million child rely benefit program traditionally served lifeline retiree
84,POLITICS,gop candidate mock democratic presidential debate hillary clinton big target
85,POLITICS,wednesday morning email making sense tuesday health care vote whats next
86,POLITICS,nan
87,POLITICS,u israel agree military deal record sum obama sought finalize deal leaf office republican sought say matter
88,POLITICS,white house make another tweak trump ban refugee certain foreign national green card holder longer need waiver enter united state
89,POLITICS,president obama preparing plan close guantanamo bay obama pledged 2008 presidential election campaign would close military prison
90,POLITICS,thursday morning email hurricane irma barrel caribbean killing least 9
91,POLITICS,phyllis schlafly kingmaker phyllis schlafly donald trump eulogized yesterday death age 92 go one
92,POLITICS,nan
93,POLITICS,supreme court weighs friendly tip worth million constitute insider trading high court defines crime could big effect whitecollar prosecution
94,POLITICS,exact debate moment candidate got attention google donald trump claim never going bankrupt got quite bit traction
95,POLITICS,dan rather trump worst start u president ever weak president running weak ragtag administration prescription trouble
96,POLITICS,moving past shock blame continue make safety political third rail province twitter medium le chance gain focus needed create behavioral change incident continue happen
97,POLITICS,fake vigil honor victim kellyanne conways madeup bowling green massacre never remember always forget
98,POLITICS,nan
99,POLITICS,solar industry brace job loss trump put fee imported panel solar industry created 1 every 50 new american job 2016
100,POLITICS,fbi probe hacker targeting democratic official phone russian suspected behind hacking attempt
101,POLITICS,nan
102,POLITICS,22 patriotic house republican loyalty united state exceed loyalty republican party
103,POLITICS,congress set date obamas last state union address speech obama lay priority final year white house
104,POLITICS,hillary clinton partly blame voter suppression loss expert arent sure say democrat talking flawed study
105,POLITICS,nan
106,POLITICS,putting disadvantaged american back work american thing though task may seem daunting way turn around country widespread unemployment underemployment answer actually right front u nation vast network transportation system key component putting american back work
107,POLITICS,ted cruz staff usaid met group called apartheid socalled injustice leader afriforum afrikaner right group also posed picture national security adviser john bolton
108,POLITICS,nan
109,POLITICS,nan
110,POLITICS,fed congressman brings mosquito congress florida republican david jolly displayed jar bloodsucker house floor prompt action zika paul ryan yawned
111,POLITICS,hillary clinton lawyer defends use personal email hillary clinton use personal email account conducting state department business followed federal rule
112,POLITICS,milwaukee mayor want patrol officer wear body camera want police officer position demonstrate beyond reasonable doubt acting professionally
113,POLITICS,democrat could win losing supreme court legislator debating fight obamas nominee without becoming obstructionist
114,POLITICS,florida gop official denies trump left ballot ballot include candidate said florida secretary state ken detzner
115,POLITICS,peter thiels support trump presidency privately faltering report 50 chance whole thing end disaster thiel reportedly said
116,POLITICS,veteran severely injured combat he ready serve congress brian mast inspired run u house seat losing leg afghanistan six year ago
117,POLITICS,interview trump lawyer jay sekulow misrepresents role secret service according two source familiar secret service protocol lawyer characterization agency misleading
118,POLITICS,nbc factcheck trump iraq bit late didnt seem matter trump
119,POLITICS,berniebro try defend happened let talk thing shes undeniably right
120,POLITICS,analyzing ferguson unimportant whether agree decision grand jury jury future trial action special investigation united state nation law grand jury spoken need move forward peaceful thoughtful lawful manner
121,POLITICS,huffpost rise morning newsbrief november 10 welcome huffpost rise morning newsbrief short wrapup news help start day
122,POLITICS,nan
123,POLITICS,republican split trump say memo doesnt mean russia probe end rep trey gowdy helped draft memo critical part investigation say there going russia probe
124,POLITICS,community terrorized immigration crackdown could destroy social fabric u think weve got reign terror many people go life noticing
125,POLITICS,bernie wing starting make peace tom perez dnc member poked berniecrats eye care
126,POLITICS,problem solution people throughout u bad opinion politician early year prepare occupation vocation never giving serious thought becoming politician
127,POLITICS,indiana mayor pete buttigieg enters dnc race military veteran south bend join crowded field
128,POLITICS,nan
129,POLITICS,kansa shooting indian widow fight immigration reform srinivas kuchibhotla killed hate crime wife immigration status thrown question
130,POLITICS,trump first sotu includes typical falsehood avoids typical insanity tomorrow new day neglected twitter feed awaits
131,POLITICS,tennessee agency failing people disability state official relinquish million dollar could fix problem
132,POLITICS,police plan weekend urban war game california see heavily armed men roleplaying benghazi attack berkeley weekend might think youve stumbled onto
133,POLITICS,new jersey baby born zikalinked birth defect may first continental u could see pain heart hospital chief obgyn said mom baby born
134,POLITICS,100 day turned america upside post first appeared billmoyerscom dont want god show say he kidding louis ck asked stephen
135,POLITICS,elizabeth warren foreclosure victim blast trump treasury pick activist say steve mnuchin ran foreclosure machine
136,POLITICS,dnc sander campaign improperly accessed clinton voter data official democratic national committee accused presidential campaign sen bernie sander improperly
137,POLITICS,michigan lawmaker introduce 21 bill targeting kid adult correction measure would ban placing youth adult jail prison altogether
138,POLITICS,trump organization ordered presidential seal trump golf course report using presidential seal trump golf course could illegal
139,POLITICS,nan
140,POLITICS,real threat voter suppression first published boston globe request senate democrat government accountability office investigating
141,POLITICS,hedge fund launch new lobbying effort protect power new lobbying campaign come amid attack democratic politician
142,POLITICS,mitt romney donald trump shifting politics personal wealth romney thought talking personal wealth would make sound arrogant
143,POLITICS,democrat want hillary clinton return dncs money national party agreed pay 165 million campaign email list resource
144,POLITICS,south la teen give powerful speech trauma surviving gun violence edna lizbeth chavez also spoke passionately gun school answer
145,POLITICS,trump grabber must go trump natural result republican culture viciously fought woman agenda year
146,POLITICS,new donald trump ad claim hillary clinton lack stamen yet last debate said doesnt quit
147,POLITICS,veep debate told u one important thing trump presidency mike penny would power trump white house hed use
148,POLITICS,abu zubaydah torture poster child last week abu zubaydah imprisoned guantanamo 14 year without charged crime appeared
149,POLITICS,gop final tax bill still boondoggle big business congressional republican final tax legislation proposes cutting tax expected business wealthy middleclass american
150,POLITICS,aide speaks michigan tea party rep covered affair like working dr jekyll mr hyde
151,POLITICS,u military think missile bomb work better strategy would like know trump intent north korea syria elsewhere
152,POLITICS,nan
153,POLITICS,donald trump called stable genius two greatest asset mental stability like really smart
154,POLITICS,vladimir putin really unpopular among american russian leader low favorability rating across group
155,POLITICS,democrat need gop signoff get question answered federal agency say office personnel management insisted congresswoman get republican cosign standard request
156,POLITICS,republican national committee pull funding roy moore senate campaign many gop senator called drop alabama special election amid allegation sexual assault
157,POLITICS,rob porter case trump sends message protect powerful alleged abuser trump turned clock back progress weve made country
158,POLITICS,nan
159,POLITICS,taking care veteran caregiver nation say thank service military veteran week new york state home
160,POLITICS,trump called white supremacist fine people athlete protest son bitch stark contrast
161,POLITICS,huffpollster winning big new york donald trump still face uncertainty meanwhile bernie sander loss mean chance slim
162,POLITICS,kushners middle east visit set failure white house senior adviser president donald trump soninlaw jared kushner leading u delegation middle
163,POLITICS,joe biden turning away refugee giving isi want turn away say way ever get would play right terrorist hand
164,POLITICS,nan
165,POLITICS,doj investigate alton sterling shooting louisiana attorney general said would fully cooperate federal investigation
166,POLITICS,house gop determined make harder poor kid get free school lunch house committee approved controversial change way lowincome child would qualify
167,POLITICS,ted cruz win delegate stake wyoming ted cruz around twothirds vote wyoming republican nominating contest
168,POLITICS,student stage antitrump art protest gop nominee alma mater supporting donald trump presidency personal attack body woman
169,POLITICS,roger stone say conversation dnc hacker completely innocuous perfunctory brief banal forgotten said
170,POLITICS,trump attack kim jong un bizarre twitter rant would never call short fat also blast suspicious russian relationship hater fool
171,POLITICS,takeaknee patriotic protest police brutality injustice seems clear donald trump manufacture grasp anything divide american even use
172,POLITICS,ben carson becomes first gop candidate weigh flint water crisis managed blame everyone michigan republican governor
173,POLITICS,dj vu democratic party spent 1999 state almost unbroken panic even incumbent democrat presided
174,POLITICS,nan
175,POLITICS,utah declared pornography health crisis utah wrong state governor signed antiporn resolution based blatant misinformation
176,POLITICS,ted cruz get another highprofile conservative endorsement chief rival donald trump working gain support conservative
177,POLITICS,degradation nationstate concept announcement u withdrawal paris climate accord defining moment implication far greater
178,POLITICS,hillary clinton call debate moderator ignoring woman health nine democratic debate far one question reproductive right
179,POLITICS,mike penny get booed like crazy hamilton
180,POLITICS,understand obamacare replacement would follow money gop plan would shift federal dollar need
181,POLITICS,nan
182,POLITICS,democratic senator say russia succeed john lewis donald trump keep bickering wish rhetoric would tone back forth said sen joe manchin dwva
183,POLITICS,huffpollster hillary clinton biggerthanexpected victory california poll didnt indicate large lead aps monday night call could affected race
184,POLITICS,house republican working plan help puerto rico democrat say gop leader negotiating good faith
185,POLITICS,two men found guilty murder fast furious killing border agent tucson ariz ap two men convicted murder thursday killing border patrol agent whose death brought
186,POLITICS,democrat back wrong candidate pennsylvania poll say joe sestak democrat spent million dollar beat would better senate nominee katie mcginty
187,POLITICS,bolton aided fbiinvestigated moscow banker nra plug russian gun right gun would better protect mother child family trump national security pick said 2013 video
188,POLITICS,voter dont trust donald trump major issue he distrusted republican candidate recent history come policy
189,POLITICS,donald trump implodes way strongest fundraising month yet eccentric real estate mogul raised 82 million
190,POLITICS,snowden tried tell nsa surveillance concern document reveal morning may 29 2014 overcast thursday washington dc general counsel office director
191,POLITICS,time resistance sanctuary city donald trump making good terrifying campaign promise ban muslim entering u round
192,POLITICS,black life matter speak unconventional crowd politics pop culture mix first politicon conference
193,POLITICS,trump charge campaign top dollar rent basically empty trump tower office tiny reelection effort spent monthly rent campaign paid 2016 run
194,POLITICS,nato uneasy new reality could still stop russia fast enough expert say even vladimir putin probe defense
195,POLITICS,white house job schwab heiress raise new ethic question trump samantha schwabs grandfather charles schwab gave 1 million trump inaugural committee shes working president
196,POLITICS,ben carson insists thing starting happen losing neurosurgeon say he giving yet
197,POLITICS,trump super pac strategist say otherness obama apparently still clinton spreading birther claim
198,POLITICS,16 historical poll show far woman come attitude gender changed lot past 80 year
199,POLITICS,people getting tattoo protect planned parenthood resistance inked
200,POLITICS,clinton sander agree 4 debate detail debate determined sanctioned dnc
201,POLITICS,trumprussia story coming together here make sense post first appeared billmoyerscom november 21 2017 editor note news coming fast furious
202,POLITICS,trump cochair actually still think obama muslim really still
203,POLITICS,donald trump actually winning republican donor class two month ago donald trump campaign manager paul manafort reassured nervous party elite candidate would start
204,POLITICS,carson top fundraiser iowa campaign cite ground game made effort get place people arent necessarily going
205,POLITICS,conservative group move block michigan gerrymandering reform new lawsuit trying block voter creating independent redistricting commission
206,POLITICS,nan
207,POLITICS,paul ryan get 15 minute fame supreme court court think twice giving much weight house say immigration
208,POLITICS,michigan ban banning plastic bag plastic bag ban bad business idaho arizona missouri also sacked local attempt cut plastic pollution
209,POLITICS,nan
210,POLITICS,gop candidate attack democrat voting right progress party supported opponent said ashamed
211,POLITICS,thursday morning email government shutdown threat loom border wall faceoff neither side look ready compromise
212,POLITICS,woman become president united state america really m cheryl rio ceo go ape marketing recently incurred barrage criticism posted personal facebook page belief woman become president united state
213,POLITICS,london borough vote ban bigoted donald trump time people want build wall
214,POLITICS,donald trump say eyeing victory indiana already gop presidential hopeful proclaimed
215,POLITICS,trump failure place focus back bigger problem congress neither gopled house gopled senate developed legislation palatable american public
216,POLITICS,nan
217,POLITICS,ferguson call action generation hope son give advice child father gave summer 2014 known something beyond anniversary civil right achievement led much progress nation
218,POLITICS,anthony weiner would rather redeem dad politician cant important element life really well
219,POLITICS,controversial congressman asked terrorist dont target irs dmvs rep blake farenthold appears congressman use fund oversight office settle sex harassment claim
220,POLITICS,supreme court set guideline trump treatment noncitizen ruling come backdrop president muslim travel ban
221,POLITICS,fourth july american needing health care health care privilege based age gender ability income health care basic human right
222,POLITICS,antisemitism know name shame talk new antisemitism sweeping globe see irrational hatred aimed perplexed victim left wondering energized bile
223,POLITICS,double standard defending christian goal create truly democratic representative system governance iraq syria voice leadership christian minority community taken account
224,POLITICS,elizabeth warren quote taylor swift slam trump commencement speech one great philosopher time said hater going hate hate hate hate hate
225,POLITICS,place renamed statue taken north well south school reopening across country social study history teacher involve student research
