,category,text
4577,TECH,check google new logo new font brighter color google
4578,TECH,john mcafee captured antivirus pioneer reportedly captured mexicobelize border blog example mcafee described elaborate step taken evade capture mcafee disputed
4579,TECH,ou kosher orthodox union release app keeping kosher passover beyond whats kosher isnt passover becomes much complicated certain kind product
4580,TECH,secret quizups record setting viral growth thing usually work mobile game developer may seem like overnight success actually result almost three year hard work obsession creating amazing product
4581,TECH,scosche boombottle review grab bike time play tune aptlynamed scosche boombottle available choice boring
4582,TECH,interest gun control fading google data show usual people appear care day following major shooting lose interest
4583,TECH,deadsocial social networking site help contact friend family beyond grave shown photo deadsocial profile share many feature typical social site there box share
4584,TECH,apple could withdraw help drug case fbi hack iphone standoff continues
4585,TECH,underwater drone could let explore ocean perfect hunt sunken treasure
4586,TECH,house finally approves bill keep old email private still certain email privacy act become law
4587,TECH,watch top 9 youtube video week youre looking see popular youtube video week look bringing
4588,TECH,watch top 9 youtube video week youre looking see popular youtube video week look bringing
4589,TECH,techbargains weekly deal smart sprinkler turbotax best deal north face laptop bag welcome techbargains weekly deal find best deal week save time money act fast stock
4590,TECH,timing io ssl vulnerability apple addition nsa prism program sure would interesting know added spurious line code file conspiratorially one could suppose
4591,TECH,5 step every victim revenge porn consider nonconsensual pornography revenge porn eliminated right
4592,TECH,amazon patented shipping item theyre even ordered course amazon wouldnt ship item ahead time absence clear demand product ass demand
4593,TECH,mother day 2012 google logo warm heart year mark first time google opted moving animation mother day since 2000 search engine
4594,TECH,flyingbuddy2 pilot mindcontrolled copter nothing thought system actually hacked together using part anyone purchase eeg headset emotiv company
4595,TECH,ipad mini retina display coming year 8megapixel camera cheap iphone week apple rumor computerworlds jonny evans selfdescribed appleholic pointed acquisition evidence iwatch
4596,TECH,facebook make money facebooks ipo filing week confirmed already knew facebook make vast majority money selling
4597,TECH,steve ballmer retirement microsoft ceo redmond wash steve ballmer paced corner office foggy january morning listening loudspeaker
4598,TECH,content brief linkedins long game pay missed take grammys embrace social medium catch right quick many social network name
4599,TECH,facerecognition billboard display ad woman men plan uk campaign london video poll men hand shown statistic regarding issue naomi williams plan uk campaign manager say
4600,TECH,apple already patched many wikileaks exploit well didnt take long
4601,TECH,way outsmart text message spammer two year ago got text message number la vega area code thanks visiting site read claim
4602,TECH,watch top 9 youtube video week youre looking see popular youtube video week look bringing
4603,TECH,use personal bitmoji snapchat blessed
4604,TECH,record 1 billion people used facebook single day wow
4605,TECH,moocs technology true education content delivery today student dont need technology dont need powerpoint computerbased learning platform need enthusiastic talented creative teacher professor see education job calling
4606,TECH,cyber monday deal find best online sale save major green thats retailer want say dan old run gabriel consulting group retail trend watching firm maximise
4607,TECH,sean parker new mission destroy cancer spoke former facebook president latest venture
4608,TECH,huffington post hiring associate tech editor fulltime position based new york city
4609,TECH,researcher discover major android security flaw many phone risk android popular mobile operating system earthabout 80 percent smartphones run according
4610,TECH,5 type people never friend facebook type facebook user think people avoid friending share thought u comment friending
4611,TECH,sneak peek huffpost brings real time collaboration newsroom youre regular reader huffington post might given much thought technology behind news article read share comment upon site since 2005 tech team huffpost working handinglove editor create ultimate digital content delivery system
4612,TECH,teen use tech build relationship destroy report texting instagram snapchat twitter arent form interaction theyre part realworld relationship
4613,TECH,skype type stuff trial beyond prepared like surgeon assistant best practice would dictate another set eye ear importantly technical assistant plenty college graduate working tech savvy hire one
4614,TECH,nintendos latest zelda arrives october multiplayer
4615,TECH,explosive facebook memo defended company strategy even got people killed connect people period thats work growth justified executive wrote 2016
4616,TECH,snl take iphone 5 problem skit pitting tech blogger chinese factory worker video show recent tech talk skit assembles mock talk show vocal tech blogger air grievance device
4617,TECH,adblocking might save ad industry klint finley wired coalition better ad consortium ad publishing tech company want save
4618,TECH,appletwitter deal work report say apple may invest social network first let try optimist perhaps apple twitter soulmates value sleekness simplicity
4619,TECH,computer next conquest crossword whats 10letter word smarty pant weekend world may find computer technology try best
4620,TECH,classic nintendo 64 game dark secret never heard hard see feature cut final version
4621,TECH,elon musk pull tesla spacex facebook page nod deletefacebook also deleted personal profile
4622,TECH,people obsessed dark side google sense disturbance force
4623,TECH,17yearold made messaging easier deaf wasnt even trying 17 yearold entrepreneur mateusz mach simple fun thought wanted make app would allow send ironic
4624,TECH,damning essay shame tech industry caring black people diversity report arent enough
4625,TECH,mark zuckerberg hold team meeting chewbacca ewoks wookiee later described meeting waaaaarrrrhhhhhgggg
4626,TECH,google privacy policy probed eu privacy regulator added privacy policy respect european law google provide precise effective answer
4627,TECH,google open sourced artificial intelligence engine tech pundit timoreilly tried new google photo app amazed depth artificial intelligence
4628,TECH,eu regulator issue record fine google anticompetitive practice action came sevenyear long investigation prompted score complaint rival
4629,TECH,monoprice 27 ipsg pro led monitor wqhd 2560x1440 product id 10489 review monoprice among interesting company probably havent heard started apartment around decade
4630,TECH,uber kill cab city must ensure accessible vehicle live urgent people realize
4631,TECH,amazon prime got big boost holiday season 3 million people joined prime week christmas
4632,TECH,infooverload underloaded quality dashlane two thing memorizes password cloud device single master password
4633,TECH,buy blackberry 10 ive spent last two week playing z10 definite pro con here need consider shelling 199 buy one
4634,TECH,inside monumental office tech giant big internet company love talk disrupting one thing another still want big company
4635,TECH,democrat likely support apple fight iphone privacy support especially strong among young people
4636,TECH,nonprofit belief anyone make city better accepting application deadline dec 23
4637,TECH,iphone 5 promise web video explosion device revolution fueling information avalanche social signal get smarter crowdbased information rapidly highly popularity critical element curation economy human getting started
4638,TECH,bug completely disable iphone apple working fix
4639,TECH,ipad maxi mini micro one size longer fit three flat touch device desk right three pretty much thing feel three thing extravagance
4640,TECH,apple announces revamped apple tv double gaming system vision tv simple perhaps little provocative
4641,TECH,mother uber ceo killed boating accident ceo father treated area hospital described moderate injury
4642,TECH,new secure credit card hurting netflix company keep credit card information updated netflix thank forever
4643,TECH,think apple watch ridiculous aint seen nothing yet yes thing
4644,TECH,youtube remix culture curation youtube revealed curation core strategy contextualizing video content curator paid leader fair use remix community taking notice
4645,TECH,reset plug save internet crap youll never get fiddle wifi router
4646,TECH,pokmon go added billion dollar nintendos value meowth thats right
4647,TECH,london olympics attendee asked knock tweeting texting hurting tv ioc spokesman said appeared problem lay oversubscription one particular network talk taken place
4648,TECH,46 best vine week one video aug 17 aug 25 2013 vine twitter microvideo social network perhaps best form entertainment generation adhd limit
4649,TECH,study find cosmic ray increased heart risk among apollo astronaut apollo astronaut ventured moon five time greater risk dying heart disease shuttle astronaut
4650,TECH,mountain biker suffers severe burn fall spark iphone explosion pretty freaking painful
4651,TECH,iphone 5 v galaxy s3 apple television christmas week apple rumor every week numerous blog covering mysterious apple empire float unconfirmed rumor blatant speculation questionably
4652,TECH,window 8 fly touchgrounded world call reductionist believe consumer wanting desktop experience tablet experience independent
4653,TECH,acta protest thousand take street march international antipiracy agreement local medium reported 600 people protested government building vilnius lithuania justice minister remigijus
4654,TECH,ted 2013 saw year ted remarkable collection thinker dreamer image past week event
4655,TECH,massive tinder photo grab latest scary warning careful post stealth sweeper say hell use 40000 photo female male facial recognition training artificial intelligence
4656,TECH,facebook release new tool combat revenge porn wrong hurtful report u use ai image recognition prevent shared across platform
4657,TECH,ipad mini event invitation video photo week apple rumor hello lady gentleman welcome week apple rumor regular look back week unconfirmed
4658,TECH,jailbreaking tablet deemed illegal u copyright office updated document seen state following u copyright office published document oct 26 specifying
4659,TECH,watch top 9 youtube video week youre looking see popular youtube video week look bringing
4660,TECH,apple name jeff williams new coo tech giant also appointed new senior vice president hardware technology
4661,TECH,little apple go long way company tweaked relatively measly investment u manufacturing impact 100 million
4662,TECH,twitter may increase character limit 10000 wont believe ceo jack dorsey made point
4663,TECH,rim hit 1472 million verdict wireless patent suit based waterloo ontario rim last month posted first operating loss eight year much deeper expected
4664,TECH,google try win back microsoft defector free software additional incentive google pay 75000 company switching software
4665,TECH,apple confirms slows old iphones battery age certain circumstance
4666,TECH,sochi olympics official website bizarre extremely russian enough baby pacifier 125 hockey team accomplishment know youre buying creepy bear mascot
4667,TECH,sheryl sandberg russian targeting facebook happened facebook owes america apology said
4668,TECH,cyber attack canadian firm could coming china case canadian government declined comment report suggested chinese connection calgarybased
4669,TECH,uberx rideshare expanding controversial app offering taxilike service new plan big city terrie prosper spokeswoman california public utility commission could immediately comment ubers new
4670,TECH,innovation financial servicesoxymoron future tech lesson learned asian financial forum today extra urgency behind need shift toward innovation many new financial service competitor small nimble cutting edge technology entered market right financial crisis established firm busy licking wound old guard going need stay top innovation keep new guard
4671,TECH,online gambling still illegal u state despite revenue growth internet gambling legal three u state
4672,TECH,personal secret get outed facebook bobbi duncan desperately wanted father know lesbian facebook told anyway read wsjcom
4673,TECH,apple fbi take dispute congress congressional panel consider case tuesday
4674,TECH,mentoring may key solving tech woman problem without woman look top many woman stem field get discouraged leave workforce however one group changing
4675,TECH,criticism uber add wheelchair option dc could good news people disability live nation capital
4676,TECH,former reddit ceo ellen pao troll winning endured one largest trolling attack history blessed astonishing
4677,TECH,facebook begin letting user know data harvested cambridge analytica social medium giant admitted 87 million user may affected
4678,TECH,company cloud ready 10 factor cio consider one technology promise help improve efficiency enable cio staff strategically focused cloud computing
4679,TECH,smartphones often illequipped mental health safety emergency researcher said query merit special attention tech company future
4680,TECH,california say selfdriving car still require human driver people arent obsolete yet
4681,TECH,apple facebook come controversial cybersecurity bill trust customer mean everything u dont believe security come expense privacy
4682,TECH,facebook temporarily killed lot user dont worry fine
4683,TECH,download entire twitter history twitter ceo dick costolo promised recent month option user download archive tweet
4684,TECH,facebook testing sirilike feature called might change use popular social network
4685,TECH,cheat iron triangle tony schwartz believe iron triangle applies almost every human endeavor throwing party keeping marriage alive 28 year plan survives first encounter reality real question corner iron triangle going compromise
4686,TECH,election shock popped progressive bubble facebook logging others turn activism
4687,TECH,watch top 9 youtube video week youre looking see popular youtube video week look bringing
4688,TECH,facebook cracking racist post germany move come urging german chancellor angela merkel
4689,TECH,many american unconcerned facebook meddling news new poll suggest nontroversy
4690,TECH,google antitrust wrist slap right result wrong reason right reason google search result free speech first amendment consideration stopped ftc investigation outset freedomofspeech never mentioned agency statement well bizarre
4691,TECH,joanne hughes kansa city mother petition get sexting statue removed park seen statue david person hughes said michelangelo statue florence noting depicted david
4692,TECH,people say dont want broadcast life facebook think
4693,TECH,facebook investigates claim employee used privileged access stalk woman facebook engineer fired allegedly selfidentifying professional stalker telling woman tinder hard find
4694,TECH,government accuses apple deliberately boosting security keep fed justice department called apple rhetoric false
4695,TECH,yahoo reportedly lowballing hulu bid according numerous source close situation yahoo bid 600 million 800 million premium video
4696,TECH,youll share pic facebook live computer mommy im scared
4697,TECH,save instagram post later without taking screen shot apps new function allows save individual post page see
4698,TECH,justine sacco apologizes aid tweet former pr executive issued formal apology tweet sent earlier week word cannot express sorry
4699,TECH,government learning change behavior supposedly good government obligated disclose behavioral science technology used public policy
4700,TECH,read buy headphone apple might render obsolete
4701,TECH,prankster rename mexico congress chamber rat google map second attack space day
4702,TECH,nokia lumia 900 price cut 50 world dominant mobile phone provider nokia late embrace smartphones also losing market share
4703,TECH,ashley madison chief resigned hacking scandal didnt take long
4704,TECH,new york city bigapps winner show civic tech maturing lesson city struggling harness power data start problem
4705,TECH,uber targeted rival lyft driver hell program report find true allegation concerning lyft said
4706,TECH,snapchat making sunglass builtin camera snap world perspective
4707,TECH,facebook prioritizes make sad angry like think react
4708,TECH,tech pulling ahead politics fight future world leader make major decision climate change cop21 conference paris technology already putting u right path
4709,TECH,facebook allow 900 million people keep message secret encryption coming messenger move without controversy
4710,TECH,microsoft amazon plan driverless car theyre making move
4711,TECH,here new york city borough look like redrawn today happens abandon centuryold five borough partitioning new york city remap city reflect reality of2017
4712,TECH,passport robot tell man asian descent eye closed robot hard feeling
4713,TECH,foxconn pay chairman pledge keep raising worker salary according agreement reached apple foxconn technology group whose subsidiary hon hai precision industry assembles
4714,TECH,surprising number american would chop finger stay online ouch
4715,TECH,new york tech scene rocked last week oh say whew pretty awesome two major financial event week panel party amazing content centered around new york growing digital ecosystem next week dont know im good practice im going keep
4716,TECH,watch amazing way information spread twitter word travel fast
4717,TECH,hacker using expired domain launch attack visitor major news site may affected
4718,TECH,talking computer changing getting rewired interact alien
4719,TECH,life recalled app holiday season 2011 hive activity one week early december managed attend party
4720,TECH,new technology could help find next harvey weinstein callisto already empowered survivor college campus people want see expand hollywood tech
4721,TECH,overshare 7 thing forget daily social medium let social medium addictive part everyday life fact habit like flipping facebook
4722,TECH,burger king twitter account hacked come attention twitter account burger king brand hacked worked directly
4723,TECH,facebooks mark zuckerberg finally detail fake news countermeasure week ago zuckerberg dismissing scourge fake news facebook
4724,TECH,4 tip safe cyber monday dont get duped
4725,TECH,facebook profile picture choice may influenced cultural background study difference eastern western culture previously studied huang park research expands
4726,TECH,microsoft unveils next best thing teleportation specialized headset camera possible beam someone 3d image another location real time
4727,TECH,man could get locked irl sending spam message facebook wallace face 250000 fine three year prison
4728,TECH,app sends alert donald trump tweet stock introducing trump trigger
4729,TECH,teen spend 9 hour screen every day expert concerned much young people multitasking
4730,TECH,dell new 67 billion deal one biggest tech history combined business create world biggest privately held integrated technology company
4731,TECH,huge breakthrough google ai beat top player game go major breakthrough artificial intelligence computing system developed google researcher great britain
4732,TECH,state would rather learn gun shop gun control way youd think
4733,TECH,woman plunge 6 foot open new jersey cellar 67yearold sustained serious injury flipping open access door
4734,TECH,police official tell congress encryption hurt ability fight crime encryption debate returned congress tuesday
4735,TECH,6 thing keep mind shopping amazon black friday plan looking online deal black friday 2013 anything like 2012 57 million american
4736,TECH,wondering vero here primer adfree privacyoriented instagram competitor exploded popularity week
4737,TECH,ewise facebook plagiarism misunderstood like recently invited wedding former best friend weve remained friend grown apart
4738,TECH,san francisco entrepreneur suggests removing riffraff homeless solution justin keller likely doesnt realize many used neighbor
4739,TECH,top 10 tech trend transforming humanity even amid year disheartening political news 2016 brought number advancement changing global tech terrain
4740,TECH,holiday season happens cultural memory go digital celebrate holiday season sure save digital memory printing backing beyond everything speak internet freedom
4741,TECH,apple see value stand protect security apple accedes american law enforcement demand opening iphone san bernardino case beijing asks
4742,TECH,watch awesome holiday message delivered using 2000 iphones sometimes come across video requires great deal exposition depth fully relate complexity
4743,TECH,microsofts chat bot reactivates immediately launch spam attack tay
4744,TECH,uc berkeley alert 80000 people cyber attack system store social security bank account number hacked
4745,TECH,10 mostliked instagram photo 2015 woman world instagram year
4746,TECH,brace even facebook notification here latest update facebook hope suck
4747,TECH,hacker typo helped stop billion dollar bank heist hacker still managed get away 80 million making one largest known bank theft history
4748,TECH,google acquires boston dynamic adding fleet robotmakers company founded 1992 marc raibert former professor massachusetts institute technology currently
4749,TECH,looking web world away traveling outside u quickly get sense much internet changed gather validate information access information use crowd knowledge changed dramatically short year
4750,TECH,digital olfaction society want help smell internet week attended think fair say oddest conference yet first world
4751,TECH,pokemon 20 year old here feed pikachu nostalgia youre 20 year older doesnt mean cant still enjoy
4752,TECH,watch top 9 youtube video week youre looking see popular youtube video week look bringing
4753,TECH,getting closer leaving home without phone thing key rejoice
4754,TECH,spotify bumble finally let judge potential date based music taste anybody find somebody love
4755,TECH,driverless car flummoxed america shoddy road infrastructure bad road could pose serious problem autonomous vehicle
4756,TECH,patent condundrum startup within startup world patent seen anticompetitive force stifle innovation place need walk tightrope world predatory patent prosecution need promote one invention current patent law
4757,TECH,amazon new streaming service cheaper standard netflix may good deal think
4758,TECH,att apple data leakage battle continues update without anyone admitting responsibility taking ownership customer overbilling clearly taken
4759,TECH,u internet connection getting faster difference three year make
4760,TECH,7 problem phone addicted phone rely extent recruit harmful project selfavoidance
4761,TECH,keith rabois coo square resigns relationship employee harassment allegation read full statement rabois tumblr wrote lawsuit accused pretty horrible thing
4762,TECH,apple submits brief opposing u government unprecedented iphone request tech giant argued government request violates company first amendment right
4763,TECH,myth aging hacker fight technology reputation young person game thats perception would like change sure young dozen idea day hardly ever completed anything older ability finish started
4764,TECH,ashley madison hacker speak nobody watching past week international medium reported hack extramarital site ashley madison parent company
4765,TECH,google could face fine squeezing rival europe tech giant refused compromise european regulator
4766,TECH,amazon added dash button company adding 11 brand button bringing total 29
4767,TECH,brain facebook little zing get someone like picture sings praise facebook thats reward center
4768,TECH,spotify raise 100 million 3 billion valuation wsj reporting himank sharma bangalore reuters spotify middle 100 million financing round could
4769,TECH,block star war spoiler social medium dont need jedi use trick
4770,TECH,apple reject new game app featuring objectionable pepe frog altright mascot doesnt make cut apple store
4771,TECH,senator wonder probotnet caucus derailed cisa amendment comment say zombie computer congressional aide
4772,TECH,moving closer designer baby humanity moving evolution natural selection evolution intelligent direction accelerating pace
4773,TECH,okay mine hacked email steven levy backchannel june 17 1972 washington dc police caught five men breaking democratic national
4774,TECH,google debut new way gchat friend new website brings big cosmetic change google hangout use
4775,TECH,7 surprising household item invade privacy secret web giant telecommunication company gotten data request national security
4776,TECH,uber driver ohio welcomed aol account youve got mail brightened day unless um didnt new mail
4777,TECH,watch drone save two teen swimmer heavy surf australia never drone fitted flotation device used rescue swimmer like
4778,TECH,facebook didnt crush upworthys traffic medium analyst buzzing last week chart prof december change facebook newsfeed algorithm bringing upworthy medium empire crashing
4779,TECH,iphone 5 launch date new itunes nfc week apple rumor every week numerous blog covering mysterious apple empire float unconfirmed rumor blatant speculation questionably
